{
  "bundle_digest": "00f0dde9d809d95077a32f06465d4ea91acbfe800fc20a0d98e085aa316461dc",
  "claim_usable_verifier_vectors": [
    {
      "attestation_ref": "demo-att-vector-1",
      "claim_usable": true,
      "decision": "pass",
      "fixture": false,
      "input_capsule_digest": "dd69f30f3ed099032fe3c16e1d55b2c269f8dc5e1c056537ee9d9a8c8cdf62e5",
      "output_digest": "7c7c38acd56b5c4f037d6ec2818f7f937f95d37ef8e7f4bec1cd21b57373a9a6",
      "vector_id": "demo-vector-1",
      "verifier_family": "alpha-independent",
      "verifier_implementation_digest": "b7fd8e98e8347f52e95f6c6aced5fa4d71e7cfd4a6a17f41b59713e5582324c6"
    },
    {
      "attestation_ref": "demo-att-vector-2",
      "claim_usable": true,
      "decision": "pass",
      "fixture": false,
      "input_capsule_digest": "dd69f30f3ed099032fe3c16e1d55b2c269f8dc5e1c056537ee9d9a8c8cdf62e5",
      "output_digest": "7c7c38acd56b5c4f037d6ec2818f7f937f95d37ef8e7f4bec1cd21b57373a9a6",
      "vector_id": "demo-vector-2",
      "verifier_family": "beta-independent",
      "verifier_implementation_digest": "5e541f0be5621b40ac18b5b0016749274b11b6956214f88a247f4a7e9aed4a40"
    },
    {
      "attestation_ref": "demo-att-vector-3",
      "claim_usable": true,
      "decision": "pass",
      "fixture": false,
      "input_capsule_digest": "dd69f30f3ed099032fe3c16e1d55b2c269f8dc5e1c056537ee9d9a8c8cdf62e5",
      "output_digest": "7c7c38acd56b5c4f037d6ec2818f7f937f95d37ef8e7f4bec1cd21b57373a9a6",
      "vector_id": "demo-vector-3",
      "verifier_family": "gamma-independent",
      "verifier_implementation_digest": "7098f9397983ad82bf79e0e6b8473c98d9b388ff7192553193aac06c21039d4c"
    }
  ],
  "firewall_profile_reviews": [
    {
      "attestation_ref": "demo-att-review-1",
      "claim_usable": true,
      "finding_level": "none",
      "fixture": false,
      "negative_cases_digest": "d8b21ada3e5e6f9726c4248c49007a91ddfed97f68fc37b03af3eee30e7f0a17",
      "profile_digest": "42c87c1578b1c097965dd3075612e795c2ebf2c3a5d59ba0abe91ed6d4a92214",
      "review_id": "demo-firewall-review-1",
      "review_scope": "aperture-public-artifact-firewall-profile",
      "reviewed_rules_digest": "98afc97f708bc7f636181efad5833b719475f592003084b1e88062a026de2af4",
      "reviewer_identity": "example-firewall-reviewer.example.org",
      "reviewer_independence_class": "external"
    }
  ],
  "independent_rebuild_receipts": [
    {
      "artifact_sha256": "bdaefb595dfc1f7ce15a297abafb240ae36a5134e9b7e184eef58f5e6cfd67d3",
      "artifact_sha3_512": "083183439a2082d81736b59cd3e081e6d83fbde71849a7650f814bd43922f523d0704c95351cafc6e87d7d78e9720f0248f53ee8b005ce4620b62a98c34ef446",
      "artifact_size": 84,
      "attestation_ref": "demo-att-rebuild-1",
      "build_instructions_digest": "4133888e5f0c16f840da8cf3731b32fda3475d0f91d90af1e5627595854a6fde",
      "builder_contact_optional": null,
      "builder_identity": "example-rebuilder-1.example.org",
      "builder_independence_class": "external",
      "byte_reproducible": true,
      "claim_usable": true,
      "environment_digest": "2332b10a258b9c06ad6ea9532c94751a24875a8ec72f6ca99bc7f881cca2d9f8",
      "fixture": false,
      "receipt_id": "demo-rebuild-1",
      "release_tag": "v20-aperture-singularity-fixture",
      "source_commit": "3ef88e6f1f74115cc8284db970a951c35e5873d2"
    },
    {
      "artifact_sha256": "bdaefb595dfc1f7ce15a297abafb240ae36a5134e9b7e184eef58f5e6cfd67d3",
      "artifact_sha3_512": "083183439a2082d81736b59cd3e081e6d83fbde71849a7650f814bd43922f523d0704c95351cafc6e87d7d78e9720f0248f53ee8b005ce4620b62a98c34ef446",
      "artifact_size": 84,
      "attestation_ref": "demo-att-rebuild-2",
      "build_instructions_digest": "4133888e5f0c16f840da8cf3731b32fda3475d0f91d90af1e5627595854a6fde",
      "builder_contact_optional": null,
      "builder_identity": "example-rebuilder-2.example.org",
      "builder_independence_class": "external",
      "byte_reproducible": true,
      "claim_usable": true,
      "environment_digest": "92d868e3eaabab26ae50e893e951596f40bc58dfd1498cc3e12e71b4f38f37bf",
      "fixture": false,
      "receipt_id": "demo-rebuild-2",
      "release_tag": "v20-aperture-singularity-fixture",
      "source_commit": "3ef88e6f1f74115cc8284db970a951c35e5873d2"
    }
  ],
  "pinned_attestations": [
    {
      "attestation_id": "demo-att-rebuild-1",
      "claim_usable": true,
      "fixture": false,
      "public_key_digest": "c6ec1fe57e55118ea92e108b397990aeab190bb2a80e5f155dbf03b0efbb4dbf",
      "signature": "dW52ZXJpZmllZCBkZW1vbnN0cmF0aW9uIHNpZ25hdHVyZSBmb3IgZGVtby1hdHQtcmVidWlsZC0x",
      "signature_algorithm": "ed25519",
      "signer_identity": "example-rebuilder-1.example.org",
      "signer_independence_class": "external",
      "statement_digest": "a5a1f4850eac52e35f486d2ae5cb46cefddd6a89bc9a5832fd9413ba1662a813",
      "subject_digest": "a49b85f98b53aa341fe1f090cbaa2ffb893bf3b7b774ffd751dc9afd2bfe7ddd",
      "verification_material_ref": "daylight/v20-aperture-singularity/pinned/external-verification-material.v20.json"
    },
    {
      "attestation_id": "demo-att-rebuild-2",
      "claim_usable": true,
      "fixture": false,
      "public_key_digest": "63c247cfe8d80699236a2480db59072533deb2c0ec908c547e90342d931785d2",
      "signature": "dW52ZXJpZmllZCBkZW1vbnN0cmF0aW9uIHNpZ25hdHVyZSBmb3IgZGVtby1hdHQtcmVidWlsZC0y",
      "signature_algorithm": "ed25519",
      "signer_identity": "example-rebuilder-2.example.org",
      "signer_independence_class": "external",
      "statement_digest": "f6ce31a9178cd52ab1162bb9c129485103f907aee87750f95bb9323d565c40dd",
      "subject_digest": "17b26c590d7c5062b5b6ecc82b94582fde584bb5154c56e753962330b435201a",
      "verification_material_ref": "daylight/v20-aperture-singularity/pinned/external-verification-material.v20.json"
    },
    {
      "attestation_id": "demo-att-review-1",
      "claim_usable": true,
      "fixture": false,
      "public_key_digest": "2b7f16b0dafa9dc50df99a316750c46e0ed9ba88117619d3ebd518c03604a638",
      "signature": "dW52ZXJpZmllZCBkZW1vbnN0cmF0aW9uIHNpZ25hdHVyZSBmb3IgZGVtby1hdHQtcmV2aWV3LTE=",
      "signature_algorithm": "ed25519",
      "signer_identity": "example-firewall-reviewer.example.org",
      "signer_independence_class": "external",
      "statement_digest": "e2643c5dc0fd3f7e865477e4ef7d556a615f7bba6200845f25b377072ecb4d7b",
      "subject_digest": "425fcfc20c49da6f05295ec866af9481bb134d0d486d769028db48463319c646",
      "verification_material_ref": "daylight/v20-aperture-singularity/pinned/external-verification-material.v20.json"
    },
    {
      "attestation_id": "demo-att-vector-1",
      "claim_usable": true,
      "fixture": false,
      "public_key_digest": "14f6a8f316244a09bba1b1b8bd77afe72e5efc3ba2f48b6f2ce76f85cbf82087",
      "signature": "dW52ZXJpZmllZCBkZW1vbnN0cmF0aW9uIHNpZ25hdHVyZSBmb3IgZGVtby1hdHQtdmVjdG9yLTE=",
      "signature_algorithm": "ed25519",
      "signer_identity": "example-verifier-1.example.org",
      "signer_independence_class": "external",
      "statement_digest": "3e2529f0821501ff08803f6fea6ca0bb7f01c65c1d82b11aa21d8c40d75b7b27",
      "subject_digest": "345ac203bcc389e7fcedf3c43087769ea0b7a40f5491cd39c55a1e5857992bf3",
      "verification_material_ref": "daylight/v20-aperture-singularity/pinned/external-verification-material.v20.json"
    },
    {
      "attestation_id": "demo-att-vector-2",
      "claim_usable": true,
      "fixture": false,
      "public_key_digest": "e9168ccff41988d784817c81dc784d21e1eca2b67c4111063dc53158543958f7",
      "signature": "dW52ZXJpZmllZCBkZW1vbnN0cmF0aW9uIHNpZ25hdHVyZSBmb3IgZGVtby1hdHQtdmVjdG9yLTI=",
      "signature_algorithm": "ed25519",
      "signer_identity": "example-verifier-2.example.org",
      "signer_independence_class": "external",
      "statement_digest": "93f09977f1a09913dc89c31a920d9bb83fe49bbfcc81b368512339bdcd5a882c",
      "subject_digest": "6af33b14fe9350ee24525cc1816f92559584ca50e4d0fc11091cbfe8aac042ff",
      "verification_material_ref": "daylight/v20-aperture-singularity/pinned/external-verification-material.v20.json"
    },
    {
      "attestation_id": "demo-att-vector-3",
      "claim_usable": true,
      "fixture": false,
      "public_key_digest": "d834d2d3fb95400cb65c952ba98b09c43ecfd96a9de33a9a60cce270eec2b58d",
      "signature": "dW52ZXJpZmllZCBkZW1vbnN0cmF0aW9uIHNpZ25hdHVyZSBmb3IgZGVtby1hdHQtdmVjdG9yLTM=",
      "signature_algorithm": "ed25519",
      "signer_identity": "example-verifier-3.example.org",
      "signer_independence_class": "external",
      "statement_digest": "6fc11a492d8f673357c284942703310d4bbd0ca492bd1d8b63442a638a9c62e8",
      "subject_digest": "09aa64df4cac8f48ca539aedf75f51d86d1a18af943864cdfa53efd3c19cad83",
      "verification_material_ref": "daylight/v20-aperture-singularity/pinned/external-verification-material.v20.json"
    }
  ],
  "schema_id": "daylight.v20.external-evidence.bundle",
  "schema_version": 1,
  "subject": {
    "aperture_capsule_digest": "dd69f30f3ed099032fe3c16e1d55b2c269f8dc5e1c056537ee9d9a8c8cdf62e5",
    "artifact_sha256": "bdaefb595dfc1f7ce15a297abafb240ae36a5134e9b7e184eef58f5e6cfd67d3",
    "artifact_sha3_512": "083183439a2082d81736b59cd3e081e6d83fbde71849a7650f814bd43922f523d0704c95351cafc6e87d7d78e9720f0248f53ee8b005ce4620b62a98c34ef446",
    "artifact_size": 84,
    "release_tag": "v20-aperture-singularity-fixture",
    "score_ceiling_report_digest": "687d5ec83f0e2ea9a0f555fe79eddbfea14af692eca84f28499befb2a6654f61",
    "source_commit": "3ef88e6f1f74115cc8284db970a951c35e5873d2"
  }
}
